A1: 繰返し回数 | B1: プログレス表示 | C1: 処理時間[ms] | F1: 乱数1個の発生に[ms] | H1: 使用機
C2: 平均 | D2: 確認実績 | E2: 繰返し総数 | G2: 平均 | H2: 機種名 | I2: プロセッサ | J2: クロック | K2: コア | L2: RAM | M2: OS
A3: 100 | B3: 無し | C3: =AVERAGE(D3:D8) -> 638.5 | D3: 600 | E3: 793 | F3: =D3/E3 -> 0.75662042875157631 | G3: =AVERAGE(F3:F8) -> 0.80727204299236222 | H3: SoftBank 007SH | I3: Qualcomm MSM8255 | J3: 1GHz | K3: シングル | L3: 512MB | M3: 2.3.1
D4: 677 | E4: 813 | F4: =D4/E4 -> 0.83271832718327188
D5: 655 | E5: 803 | F5: =D5/E5 -> 0.81569115815691162
D6: 633 | E6: 801 | F6: =D6/E6 -> 0.79026217228464424
D7: 617 | E7: 766 | F7: =D7/E7 -> 0.8054830287206266
D8: 649 | E8: 770 | F8: =D8/E8 -> 0.84285714285714286
A9: 1000 | C9: =AVERAGE(D9:D14) -> 8569.5 | D9: 8737 | E9: 9764 | F9: =D9/E9 -> 0.89481769766489139 | G9: =AVERAGE(F9:F14) -> 0.88768581528141455
D10: 8490 | E10: 9451 | F10: =D10/E10 -> 0.89831763834514866
D11: 8621 | E11: 9702 | F11: =D11/E11 -> 0.88857967429396001
D12: 8353 | E12: 9455 | F12: =D12/E12 -> 0.88344791115811738
D13: 8646 | E13: 9785 | F13: =D13/E13 -> 0.88359734287174241
D14: 8570 | E14: 9768 | F14: =D14/E14 -> 0.87735462735462733
A15: 100 | B15: 有り | C15: =AVERAGE(D15:D20) -> 1389.6666666666667 | D15: 1465 | E15: 820 | F15: =D15/E15 -> 1.7865853658536586 | G15: =AVERAGE(F15:F20) -> 1.6344726411516064
D16: 1378 | E16: 874 | F16: =D16/E16 -> 1.5766590389016018
D17: 1383 | E17: 863 | F17: =D17/E17 -> 1.6025492468134415
D18: 1307 | E18: 863 | F18: =D18/E18 -> 1.5144843568945539
D19: 1457 | E19: 850 | F19: =D19/E19 -> 1.7141176470588235
D20: 1348 | E20: 836 | F20: =D20/E20 -> 1.6124401913875599
A21: 1000 | C21: =AVERAGE(D21:D26) -> 14368.333333333334 | D21: 16081 | E21: 9697 | F21: =D21/E21 -> 1.6583479426626793 | G21: =AVERAGE(F21:F26) -> 1.4880097902521874
D22: 14470 | E22: 9594 | F22: =D22/E22 -> 1.5082343131123619
D23: 13958 | E23: 9629 | F23: =D23/E23 -> 1.4495793955758647
D24: 14067 | E24: 9688 | F24: =D24/E24 -> 1.4520024772914946
D25: 13940 | E25: 9782 | F25: =D25/E25 -> 1.4250664485790228
D26: 13694 | E26: 9544 | F26: =D26/E26 -> 1.4348281642917016